{"pageProps":{"post":{"slug":"example-post-2","title":"Lorem Ipsum","date":"2022-04-03","image":"first-post.jpg","excerpt":"How to build a blog using react-markdown to render posts written in markdown","isFeatured":true,"tech":["Markdown"],"content":"\n# Using Markdown as a blog format\n\n![Image ...](/portfolio/images/posts/first-post/first-post.jpg)\n\n```text\n---\ntitle: 'Using Markdown as a blog format'\ndate: '2022-04-03'\nimage: first-post.jpg\nexcerpt: 'How to build a blog using react-markdown to render posts written in markdown'\nisFeatured: true\n---\n\n```\n\nLorem ipsum dolor sit, amet consectetur adipisicing elit. Dignissimos minima optio omnis commodi atque modi, dolores saepe nostrum vero sunt obcaecati recusandae animi delectus veritatis ut nam dolore magnam.\n\nLorem ipsum dolor sit amet consectetur, adipisicing elit. Debitis, explicabo necessitatibus cumque quis, labore incidunt facere dolor impedit odio fugit totam, praesentium blanditiis consequatur deleniti repellat reprehenderit modi aut enim.\n"}},"__N_SSG":true}